exp_id	date	tps	mfu_percent	step_time_ms	peak_hbm_gib	config	status	description
exp34	2026-04-23	30285	n/a	135.24	TBD	seq=1024|batch=1|fsdp=4|bf16|jax-native-nnx-port|xla-sdpa-attn	keep	native-JAX (Flax NNX) port of Gemma4 E4B with wiki-native trainer; 30,285 TPS vs torchax 30,570 baseline-seq1024 (-0.9% noise), -9.2% vs exp25 (no splash yet); loss trajectory 3.92->2.30 matches torchax reference within bf16 noise; per-layer parity vs HF PyTorch PASSES (max err 0.031 bf16); writeup 2026-04-23-exp34-jax-baseline-accepted.md
exp35	2026-04-23	30386	n/a	134.80	16.43	seq=1024|batch=1|fsdp=4|bf16|jax-nnx|splash-attn|block=1024|SEQ_MINOR|fused_bwd	parked	splash pallas attention wired into the native-JAX port via jax.experimental.pallas.ops.tpu.splash_attention; +0.33% TPS vs exp34 (flat, within noise) at batch=1 seq=1024; HLO diff shows -65.6ms on convolution-fusion but +16.8ms custom-fusion; peak HBM 16.43 GiB vs 16.85 GiB baseline (-0.4 GiB, enables batch=3 follow-up); loss bit-matches exp34 at step 19 (2.2969); writeup 2026-04-23-exp35-jax-splash-potential.md
exp36	2026-04-23	34614	n/a	355.00	27.11	seq=1024|batch=3|fsdp=4|bf16|jax-nnx|splash-attn|block=1024|SEQ_MINOR|fused_bwd	keep	splash + batch=3 in JAX stack (only env/flag delta vs exp35); +13.9% TPS over exp35 (30,386->34,614), new JAX-stack best; BEATS torchax session-best (exp25 33,372 TPS) by +3.7% without bf16 CE yet; peak HBM 27.11 GiB / 86.75% (fits comfortably — static 16.44 + heap 10.67 + free 4.14); HLO diff: custom-fusion (splash) near-constant 169->175 ms (1.03x) while conv-fusion 549->1512 (2.75x) and loop-fusion 332->1265 (3.81x) grew sub-linearly & super-linearly respectively; collective-permute-done newly prominent at 12.2% step time (SPMD re-shard pattern); loss descends 3.81->1.84 cleanly; writeup 2026-04-23-exp36-jax-splash-batch3-accepted.md
exp37	2026-04-23	34629	n/a	354.85	27.45	seq=1024|batch=3|fsdp=4|bf16|jax-nnx|splash-attn|JAX_CE_DTYPE=bf16	parked	bf16 CE gate on top of exp36 (splash+b=3); +0.04% TPS over exp36 (34,614->34,629) — dead flat; peak HBM 27.45 GiB / 87.84% (+0.34 GiB stack, heap unchanged at 10.67 GiB); loss matches exp36 within 0.3%; HLO graph bit-identical to exp36 minus one implicit-cast in reduction. Root cause of the no-op: the native-JAX port never had the fp32 upcast that torchax exp12 removed — forward_loss has always been bf16 log_softmax by construction (since exp34). Delivered a JAX_CE_DTYPE={bf16,fp32} env-var gate (default bf16=exp36 behavior); the durable artifact is the gate, not a TPS win. Exp 36 remains JAX-stack best at 34,614 TPS. writeup 2026-04-23-exp37-jax-splash-b3-bf16ce-potential.md
exp38	2026-04-23	34634	n/a	354.80	TBD	seq=1024|batch=3|fsdp=4|bf16|splash|bf16_CE|LIBTPU:latency_hiding_scheduler=true	inconclusive	latency-hiding-scheduler flag in isolation on JAX splash+b3 stack; +0.06% flat (mirrors torchax exp 30); ICI-bandwidth floor confirmed on both stacks; not a lever; writeup 2026-04-23-exp38-jax-latency-hiding-potential.md
exp39	2026-04-23	32402	21.58	505.64	TBD	seq=1024|batch=4|fsdp=4|bf16|splash|bf16_CE|selective_remat	discard	JAX stack batch=4 fits where torchax exp 22 OOM'd; -6.4% TPS vs exp36 (memory pressure degrades per-token cost); MFU 23.05->21.58%; b=3 sweet spot confirmed on both stacks; not merged; writeup 2026-04-23-exp39-jax-splash-batch4-rejected.md
exp40	2026-04-23	31809	21.18	515.07	TBD	seq=2048|batch=2|fsdp=4|bf16|splash|bf16_CE|selective_remat	keep	JAX seq=2048 b=2 FITS (torchax exp10/11/23 compile-OOM'd same config); -8.1% vs exp36 (dominated by b=3 s=1024); MFU 23.05->21.18%; proves JAX port has smaller compile-time peak HBM than torchax by the ~1.25 GiB margin; accepted as long-seq reference; writeup 2026-04-23-exp40-jax-seq2048-batch2-accepted.md
exp41	2026-04-23	29832	19.87	411.91	TBD	seq=1024|batch=3|fsdp=4|bf16|splash|bf16_CE|LIBTPU:scoped_vmem_limit_kib=524288	discard	VMEM limit 128 MiB -> 512 MiB on JAX splash+b3 stack; -13.8% TPS; XLA cost model over-commits with bigger budget; default 128 MiB is the sweet spot on v6e-4 for this workload; not merged; writeup 2026-04-23-exp41-jax-vmem-512-rejected.md
exp42	2026-04-23	34629	23.06	354.85	TBD	seq=1024|batch=3|fsdp=4|bf16|splash|bf16_CE|LIBTPU:async_collective_fusion=true	inconclusive	async_collective_fusion flag in isolation on JAX splash+b3 stack; +0.04% flat; third isolation data point (w/ exp 38 latency-hiding + torchax exp 31); bundle regression must be combinatorial; not merged; writeup 2026-04-23-exp42-jax-async-collective-fusion-potential.md
exp43	2026-04-24	n/a	n/a	n/a	n/a	seq=1024|batch=3|fsdp=4|bf16|splash|bf16_CE|tokamax.linear_softmax_cross_entropy_loss	discard	tokamax fused linear+softmax+CE attempted on JAX splash+b3 stack; INVALID — no run. tokamax public API (api.py) has no logits_soft_cap kwarg and Gemma 4 final_logit_softcapping=30.0 is a non-linear tanh on [B,S,V] logits that cannot be folded into hidden or weight (algebraically impossible) and cannot be applied post-kernel without materializing [B,S,V] which defeats the kernel's purpose. Skipping softcap violates program.md "What you CANNOT do". Gap is already catalogued in program.md § Pallas kernels to BUILD → Fused final logit softcap + log-softmax + NLL (build, not drop-in). No code merged. Exp 36 remains JAX-stack best at 34,614 TPS. writeup 2026-04-23-exp43-jax-tokamax-ce-rejected.md
exp44	2026-04-24	34461	22.95	356.57	TBD	seq=1024|batch=3|fsdp=4|bf16|splash|bf16_CE|LIBTPU:scoped_vmem_limit_kib=65536	inconclusive	VMEM limit 128 MiB -> 64 MiB symmetric to exp 41; -0.44% flat; combined with exp 41 confirms default 128 MiB is the local optimum; not merged; writeup 2026-04-24-exp44-jax-vmem-64-potential.md
exp45	2026-04-24	34621	23.06	354.0	TBD	seq=1024|batch=3|fsdp=4|bf16|splash|bf16_CE|JAX_COMPILATION_CACHE_DIR=/tmp/jax_compile_cache	keep	persistent JAX compile cache; first run populates cache (compile 180s+180s=360s), second run hits cache (15s+14s=29s); 6.67x faster total wall clock (389s -> 58s); steady-state TPS unchanged; recommend default-on for future runs; writeup 2026-04-24-exp45-jax-compile-cache-accepted.md
exp48a	2026-04-24	34626	23.06	354.88	TBD	seq=1024|batch=3|fsdp=4|bf16|splash|SPLASH_BLOCK_KV_COMPUTE=512	inconclusive	splash sweep variant: inner compute tile half of outer; +0.03% flat; writeup 2026-04-24-exp48-jax-splash-param-sweep-potential.md
exp48b	2026-04-24	34569	23.02	355.47	TBD	seq=1024|batch=3|fsdp=4|bf16|splash|SPLASH_QKV_LAYOUT=HEAD_DIM_MINOR	inconclusive	splash sweep variant: HEAD_DIM_MINOR layout (opposite of SEQ_MINOR default); -0.13% flat; torchax exp24 +0.5% didn't reproduce on JAX; writeup 2026-04-24-exp48-jax-splash-param-sweep-potential.md
exp47	2026-04-24	32671	21.76	376.12	TBD	seq=1024|batch=3|fsdp=4|bf16|splash|JAX_CE_IMPL=levanter|block=(1024,256,512)	discard	marin/levanter fused Pallas linear+softcap+CE kernel on JAX splash+b3 stack; -5.61% TPS vs exp36 (34,614->32,671); parity PASS (bf16 |diff|=0.048 vs tol=0.05), smoke step-4 loss within 0.47% of exp36; regression root-caused to Pallas custom-call boundary + 1.31 GiB lm_head-weight all-gather inside shard_map breaking XLA's existing lm_head+softcap+log_softmax fusion (CE was <3% of step time at b=3, not a bottleneck); softcap gap from exp43 is closed (levanter API has logit_soft_cap kwarg applied inline on each VMEM tile), but the integration tax outweighs the savings on this workload. Custom-call-tax pattern mirrors torchax exp33 (Pallas RMSNorm). Not merged. Exp 36 remains JAX-stack best at 34,614 TPS. writeup 2026-04-24-exp47-jax-levanter-ce-rejected.md
exp49	2026-04-24	27290	18.17	450.27	TBD	seq=1024|batch=3|fsdp=4|bf16|splash|JAX_SCAN_LAYERS=1	keep	scan-over-layers in JAX stack (two nested jax.lax.scan replacing the 42-iter Python for-loop); outer scan over 7 super-blocks, inner scan over 5 sliding layers per block, 1 full-attention layer per block applied inline. Compile step 0: 180s -> 69.3s (-61.5%, 2.6x faster) — DURABLE compile-time win. TPS regressed -21.2% (34,614 -> 27,290), MFU 23.05% -> 18.17%. Loss match clean: step 4 2.1875 -> 2.1990 (+0.5%), step 19 1.8359 -> 1.8441 (+0.5%). Regression sources: wasted k_proj/v_proj matmuls on 18 KV-shared layers (zero-stub weights still materialize in HLO inside scan body); jax.checkpoint per-layer remat forced uniformly (prevented 35 GiB scan-activation OOM); splash+shard_map nested inside scan limits XLA collective scheduling. Env gate off by default (JAX_SCAN_LAYERS=1 to enable); exp 36 remains JAX-stack best. Code on main; useful for compile-budget-constrained dev loops on cache miss where the 180->69s floor drop matters more than steady-state TPS. writeup 2026-04-24-exp49-jax-scan-layers-potential.md
exp50	2026-04-24	29044	19.34	423.08	TBD	seq=1024|batch=3|fsdp=4|bf16|splash|JAX_SCAN_LAYERS=1|two-scan-split|no-outer-ckpt	keep	scan-over-layers tuned: two separate scans (4-block non-shared producing K/V store in carry; 3-block shared reading K/V from closure) eliminates exp 49's zero-stub matmuls on 18 KV-shared layers. Applied Fix A (no inner checkpoint) which OOM'd at 52 GiB, fell back to Fix B (inner jax.checkpoint with policy=checkpoint_dots_with_no_batch_dims matching exp 36's outer policy). Additional fix: removed outer jax.checkpoint(forward_loss, policy=...) in train.py when JAX_SCAN_LAYERS=1 — nested checkpoints were double-remat'ing (saved ~34 ms/step, 7.9%). Compile step 0: 180s -> 72.7s fresh (-59.6%). TPS 34,614 -> 29,044 (-16.1% all-sample) or 30,778 (-11.1% excluding one 828ms step-9 outlier that is non-structural). +6.4% TPS (all-sample) or +12.8% (outlier-excluded) over exp 49. MFU 20.50% (17-sample) / 19.34% (all-sample). Loss step 4 2.1875 -> 2.1730 (-0.66%), step 19 1.8359 -> 1.8271 (-0.48%), well within 5% tolerance. Closes ~5 of 21 pt exp 49 regression but still >5% TPS off exp 36. Env gate off by default; exp 36 remains JAX-stack best. writeup 2026-04-24-exp50-jax-scan-tuned-potential.md
exp51	2026-04-24	13792	9.19	890.93	TBD	seq=1024|batch=3|fsdp=4|bf16|xla_sdpa|scan_layers|checkpoint_dots	discard	scan+XLA SDPA isolation test; -60% vs exp36, -52% vs exp50 splash+scan; refutes splash-as-culprit hypothesis; XLA cannot share [B,H,S,S] score tensor across scan iterations; scan REQUIRES splash/flash-like internal tiling; not merged; writeup 2026-04-24-exp51-jax-scan-xla-sdpa-rejected.md
exp52	2026-04-24	26807	TBD	305.6	TBD	seq=2048|batch=1|fsdp=4|fp32-master+bf16-compute|splash|new-regime	keep	NEW REGIME BASELINE (fp32 master weights + bf16 compute AMP). User asked for seq=8192 b=1 fp32-master — OOMs on v6e-4 at 35.18 GiB vs 31.25 GiB (exceeded by 3.93 GiB); legacy bf16 also OOMs at seq=8192 (36.16 GiB, -4.91 GiB short). seq=4096 b=1 fp32-master also OOMs (39.58 GiB); non-monotonic XLA scheduling. seq=2048 b=1 fp32-master is largest feasible config, steady-state 305.6 ms/step -> 26,807 TPS. -15.7% vs exp40 (seq=2048 b=2 bf16-only at 31,809 TPS) but exp40 shape (b=2) is infeasible under fp32-master. Loss descent clean 3.25->2.30, no NaN, matches exp40 within bf16 noise. AMP implementation: NNX Linear/Embedding/RMSNorm split weights_dtype/compute_dtype kwargs; weight downcast to compute_dtype at matmul call; weight_loader scatter-shards fp32 directly into sharded NNX params (avoids the 10.5 GiB fp32 PLE on single-device init OOM). JAX_REMAT_POLICY env var exposed {dots_with_no_batch_dims, nothing_saveable, offload_dot_with_no_batch_dims, ...}; nothing_saveable and offload are WORSE at seq=8192 (39.66 and 38.17 GiB resp.) — XLA planner doesn't credit offload as HBM-freed. writeup 2026-04-24-exp52-jax-fp32master-seq2k-accepted.md
exp53	2026-04-24	26807	TBD	305.6	TBD	seq=2048|batch=1|fsdp=4|fp32-master+bf16-compute|splash|SPLASH_BLOCK=512	discard	Splash block-size sweep under the new regime. Block=2048 (full-tile) errors with CompileTimeScopedVmemOom (32.14 MiB needed vs 32 MiB VMEM limit, 144 KiB over). Block=512 is dead flat vs exp 52 default (block=1024): 305.6 ms median, 26,807 TPS, -0.0% within noise. Confirms the old-regime exp 48 plateau transfers to the new regime — splash block size is not a TPS lever for Gemma 4 E4B on v6e-4 at any shape measured so far. Not merged; exp 52 remains new-regime baseline. writeup 2026-04-24-exp53-jax-splash-block-sweep-fp32master-rejected.md
exp55	2026-05-12	-	-	-	-	seq=2048|batch=1|fsdp=4|fp32-master+bf16-compute|splash|JAX_SCAN_LAYERS=1	crash	Scan-over-layers enabled (JAX_SCAN_LAYERS=1) at the new fp32-master baseline. Crashed with CompileTimeHbmOom during step 0 (Used 31.91G of 31.25G hbm). The fp32-master config at seq=2048 b=1 is already at 98.8% memory capacity (leaving ~350MB free); the slight structural memory overhead of the scan body + inner checkpoint policy exceeded the remaining capacity. Proves that scan-over-layers cannot be evaluated at the current shape without prior memory-saving optimizations. writeup 2026-05-12-exp55-jax-scan-layers-fp32master.md
